{
  "id": "tide-starter",
  "name": "Tide Starter",
  "description": "Tempo and attrition: freeze and bounce the threats, draw past them, then buff a lasting board with Swell, Coral Font and Fracture payoffs.",
  "faction": "tide",
  "cards": [
    { "card": "tide.shoal-sprite", "count": 2 },
    { "card": "neutral.shardling", "count": 2 },
    { "card": "neutral.binding-thread", "count": 1 },
    { "card": "tide.moonpull", "count": 2 },
    { "card": "tide.brine-adept", "count": 2 },
    { "card": "tide.mire-eel", "count": 2 },
    { "card": "tide.rime-snare", "count": 2 },
    { "card": "tide.brinesong", "count": 2 },
    { "card": "tide.coral-font", "count": 2 },
    { "card": "tide.receding-wave", "count": 2 },
    { "card": "tide.reefkeeper", "count": 2 },
    { "card": "tide.spring-tide", "count": 1 },
    { "card": "tide.pearl-oracle", "count": 2 },
    { "card": "neutral.shard-construct", "count": 2 },
    { "card": "neutral.crystal-rupture", "count": 2 },
    { "card": "tide.deepcurrent-behemoth", "count": 2 }
  ]
}
