{
  "id": "ember-starter",
  "name": "Ember Starter",
  "description": "Front-loaded aggression: cheap attackers and burn early, sacrifice and Echo in the mid game, Cinderfall against swarms.",
  "faction": "ember",
  "cards": [
    { "card": "ember.cinderling", "count": 2 },
    { "card": "ember.spark-dart", "count": 2 },
    { "card": "ember.pyre-offering", "count": 2 },
    { "card": "neutral.shardling", "count": 2 },
    { "card": "neutral.binding-thread", "count": 2 },
    { "card": "ember.blaze-mastiff", "count": 2 },
    { "card": "ember.roaring-pyre", "count": 2 },
    { "card": "ember.ash-warden", "count": 2 },
    { "card": "ember.flamebound-zealot", "count": 2 },
    { "card": "ember.ember-lance", "count": 2 },
    { "card": "ember.rise-from-cinders", "count": 2 },
    { "card": "neutral.shard-construct", "count": 2 },
    { "card": "ember.cinderfall", "count": 2 },
    { "card": "neutral.crystal-rupture", "count": 2 },
    { "card": "ember.ashborn-drake", "count": 2 }
  ]
}
